{
 "contract_version": 1,
 "app_version": "0.1.0",
 "run_id": "bw_knob1",
 "scene": "bw_pingpong",
 "declared_bottleneck": "bandwidth",
 "effective_knobs": {"loadop": "on"},
 "params": {"frames": 3000, "intensity": 6, "rt_width": 2048, "rt_height": 2048},
 "render_thread_name": "RefbenchRender",
 "driver_submit_thread_name": "RefbenchDrv",
 "renamed_driver_threads": 1,
 "gpu_name": "Adreno (TM) 840",
 "swapchain": {"present_mode": "MAILBOX", "format": "R8G8B8A8_UNORM", "width": 2688, "height": 1216, "image_count": 5, "pre_transform": "0x2"},
 "passes": [
  {"name": "ping_0", "target": "rtB", "load_op": "DONT_CARE", "store_op": "STORE", "width": 2048, "height": 2048, "format": "R16G16B16A16_SFLOAT"},
  {"name": "ping_1", "target": "rtA", "load_op": "DONT_CARE", "store_op": "STORE", "width": 2048, "height": 2048, "format": "R16G16B16A16_SFLOAT"},
  {"name": "ping_2", "target": "rtB", "load_op": "DONT_CARE", "store_op": "STORE", "width": 2048, "height": 2048, "format": "R16G16B16A16_SFLOAT"},
  {"name": "ping_3", "target": "rtA", "load_op": "DONT_CARE", "store_op": "STORE", "width": 2048, "height": 2048, "format": "R16G16B16A16_SFLOAT"},
  {"name": "ping_4", "target": "rtB", "load_op": "DONT_CARE", "store_op": "STORE", "width": 2048, "height": 2048, "format": "R16G16B16A16_SFLOAT"},
  {"name": "ping_5", "target": "rtA", "load_op": "DONT_CARE", "store_op": "STORE", "width": 2048, "height": 2048, "format": "R16G16B16A16_SFLOAT"},
  {"name": "present_blit", "target": "swapchain", "load_op": "DONT_CARE", "store_op": "STORE", "width": 2688, "height": 1216, "format": "R8G8B8A8_UNORM"}
 ],
 "debug_labels_supported": true,
 "frames_submitted": 3000,
 "clean_exit": true
}
